{
  "all_passed": false,
  "checked_count": 100,
  "checks": [
    {
      "benchmark_id": "bmk-v1-001",
      "candidate_sha256": "49f41f0d0bfcea3a6c862eb6e40d9c1bde017f3f430f7242d58e5a0e8fe1b84c",
      "protected_content": "pass",
      "unit_id": "7549178a9152fd2cf3b69e7053ccc1e0d12226038a8b058edbe0bb3c97463fd8"
    },
    {
      "benchmark_id": "bmk-v1-002",
      "candidate_sha256": "817bf35f8adb66b9422471448ac4107db99e0900097efea498f9dd6b98e2b17b",
      "protected_content": "pass",
      "unit_id": "8ad6aa5f8d20f2bd18df6aee394f22245f310881fe2286499b98079eabe2ae48"
    },
    {
      "benchmark_id": "bmk-v1-003",
      "candidate_sha256": "77cd2d7f99c539a533d64ce8de4405c0e7372882a207fc3f20d2d81b8a5b4bf8",
      "protected_content": "pass",
      "unit_id": "eb8104623b67902bf1aa12614278b171d2c9d75f6dd5d2869e50ca2a84825a69"
    },
    {
      "benchmark_id": "bmk-v1-004",
      "candidate_sha256": "6635c76097021e4fc0c8e6e04afaf4d9c26247812104685e91c84a043b655352",
      "protected_content": "pass",
      "unit_id": "9eef8f26fe958d0a6f2669fa0fc896c020b4949271b105d440c32622a7c49c34"
    },
    {
      "benchmark_id": "bmk-v1-005",
      "candidate_sha256": "a8c8778a7d8710a7e1625d61a9a2f6434dfe67c69ae0d947cf24908aa2339a9a",
      "protected_content": "pass",
      "unit_id": "760a6754c06629ef9e7191c04cf12176b1a01e1d7d74c860ddff21a8afbd3b6e"
    },
    {
      "benchmark_id": "bmk-v1-006",
      "candidate_sha256": "8d5e62fbb8238423793039f93662943615eeec3cdd478fab099e07787ced222a",
      "protected_content": "pass",
      "unit_id": "14b7a49676a2332db5c4eb66cd7e00faca234544533035ccb53e12ecb8e5b852"
    },
    {
      "benchmark_id": "bmk-v1-007",
      "candidate_sha256": "3a18e1e373de15a07bacd21fa6f91c6e6e5b32c9af7533609381e17ea2213732",
      "protected_content": "pass",
      "unit_id": "ce3522ed4c0a6b1f690078613d6009757e88a101af95e206a05c606b325e7a58"
    },
    {
      "benchmark_id": "bmk-v1-008",
      "candidate_sha256": "14e2aeca3d6880d63052530135339c23164fb43b56491c2fd0eec8f335cb233a",
      "protected_content": "pass",
      "unit_id": "eb9ca1f1764b5bdb61aae283e30bdb53e14f2248b112252fce26b153c1bfeb71"
    },
    {
      "benchmark_id": "bmk-v1-009",
      "candidate_sha256": "669159935b489cf0a275533384ef4eb9cb29bda3ccdc517a83f7a4c339e85392",
      "protected_content": "pass",
      "unit_id": "5f814e294df581454bc4ceb7a527ff1a90119fca165ab1a5cd56c947288d26f6"
    },
    {
      "benchmark_id": "bmk-v1-010",
      "candidate_sha256": "7252fd5bac81e773037c9d39bdb83aba9621abf984c19cd20a055b0265bbd797",
      "protected_content": "pass",
      "unit_id": "433c9d4f97b19e2af68054d462b1afec1018f7c373b7cf7a30a95132ce15bc59"
    },
    {
      "benchmark_id": "bmk-v1-011",
      "candidate_sha256": "97e64c2611d904890d1bc64b6f66345889dba00089633aec88fa2e00577e9bb8",
      "protected_content": "pass",
      "unit_id": "304e1483d5ee5f6b8528e94df7e0dbcee804196ecb8ced0f843a5ab4078f6808"
    },
    {
      "benchmark_id": "bmk-v1-012",
      "candidate_sha256": "6769fc323a8dd9ad7aa82f4a4d303f01e75d01f6a6ca9787ed6b1afc4b5db7d0",
      "protected_content": "pass",
      "unit_id": "e536c37d6069fe1789a6ba463c1230bfc28f3269c2a265bacde047f0dc8bab7d"
    },
    {
      "benchmark_id": "bmk-v1-013",
      "candidate_sha256": "e71b609580b42f03af981d38769d45da644d250949c6625d28190442f0709c76",
      "protected_content": "pass",
      "unit_id": "fa76159e7dbbbc600f4df2f29c144d21f78471b505992e6011e8f32f68420da7"
    },
    {
      "benchmark_id": "bmk-v1-014",
      "candidate_sha256": "faf07d3f1eb8d26547c169b9dd75597bbd822cc716c3d59456a878c9002b29f9",
      "protected_content": "pass",
      "unit_id": "90806d127badcf4b587e49581c86cba6ea6375e7c0194408513bca632e385da9"
    },
    {
      "benchmark_id": "bmk-v1-015",
      "candidate_sha256": "bbf94f91a4fe4723d755a751a9baf48cfc7273fa12a745128305f448a464f5e1",
      "protected_content": "pass",
      "unit_id": "ff10f290ad4779dcc5894f2ac35e9e1ba00e80e86ff6efdfed8a109402f0eea5"
    },
    {
      "benchmark_id": "bmk-v1-016",
      "candidate_sha256": "7bb921357c616d4cbd6ae5d4368d80b0eceefcd54c7db7c19fcba195480e0ad2",
      "protected_content": "pass",
      "unit_id": "b4ed725138733bf54d67c40a54dc5e6546383f23846449613c86a3e9c62c73e2"
    },
    {
      "benchmark_id": "bmk-v1-017",
      "candidate_sha256": "b2d74c2887a52a0abf1c24bb00c2ca246e4619bad50e08878d4468f402363f80",
      "protected_content": "pass",
      "unit_id": "7870b281bbaa80b2a073df8a49bb0f11cba0f5de6f6124c4397cba22357065bf"
    },
    {
      "benchmark_id": "bmk-v1-018",
      "candidate_sha256": "a6a073c0826c3724d5ba8237128006f98c36588f8ff352aec574ab2069d6c4b2",
      "protected_content": "pass",
      "unit_id": "1d7ea6a124ccd52e6870ff2f3f7f13713a4326531832ae1e8d6ec04ee9b10d80"
    },
    {
      "benchmark_id": "bmk-v1-019",
      "candidate_sha256": "7f95ca5a94710a8bde5c9508fb91ee195009bef35c33032abbc5c41543e3302e",
      "protected_content": "pass",
      "unit_id": "4eef6a22ab06b811841eb00de7e43ce96bad025982a4cba4e2ea5a135232bf6c"
    },
    {
      "benchmark_id": "bmk-v1-020",
      "candidate_sha256": "af823c14b93ae84f71214daa6b3fecf88d021b9570fc31e497041c8980da77a2",
      "protected_content": "pass",
      "unit_id": "248c91861b163395badf3da01c840e62b5494417c422002502b7a874b8b51aee"
    },
    {
      "benchmark_id": "bmk-v1-021",
      "candidate_sha256": "e30f2c1b2bcc83a96706dfc9ad0a4a69b753d5a5d9c813b4a5ee786b7b53d8ed",
      "protected_content": "pass",
      "unit_id": "f231c572db97a5b4d50209d337e4855eb6c4775228250dd52ffbef3ada3d61e0"
    },
    {
      "benchmark_id": "bmk-v1-022",
      "candidate_sha256": "3280feb160e715659e360cdf142376cdb88f4a7467ee32ecff8123e7c62fb489",
      "protected_content": "pass",
      "unit_id": "7ee8bed830a53b99f687e9a1d52be21651c30dcd53e20e249f067dfee33297df"
    },
    {
      "benchmark_id": "bmk-v1-023",
      "candidate_sha256": "07b9a06a6a3a2011ab1f1d3f408d333ca8346a8164607d3964d1036a29672a57",
      "protected_content": "pass",
      "unit_id": "5f806663f4e281fd73fc4542ccca994e98b7763e8170e71480adf9ee48f08acc"
    },
    {
      "benchmark_id": "bmk-v1-024",
      "candidate_sha256": "a87bd542ceb8bb3da9ec9d9f96bbe8da9bf9ae762c45a22372216c7949277d16",
      "protected_content": "pass",
      "unit_id": "7837691427f97e3bdd3589c33196b8f4a44b5b82f2bc5f57bff03f760679b5b0"
    },
    {
      "benchmark_id": "bmk-v1-025",
      "candidate_sha256": "34170e0eff0deb557e96dab09654eda02d8e47244c077240c2f9916e3d21106a",
      "protected_content": "pass",
      "unit_id": "4af4b1fa447e0f7c1f235d96ab6d8c22e8147e6da0dbfb585978d7fa86077d46"
    },
    {
      "benchmark_id": "bmk-v1-026",
      "candidate_sha256": "dcfe220fa81b0228a1da39bf6814a87763ba805d438d719af7364c38b8b3b75f",
      "protected_content": "pass",
      "unit_id": "441752e9f7ef9b3ba7df041454423ab246463e27f46b81187a1c71477206b494"
    },
    {
      "benchmark_id": "bmk-v1-027",
      "candidate_sha256": "722571a2c8a98e5425e8d3b4881646f529092a1685b751f691d2a4f1b0e8f0d8",
      "protected_content": "pass",
      "unit_id": "0c9765ee2e373e15834dfbb3a38b1647e9145c7ed8c0d3488d66586522d0defb"
    },
    {
      "benchmark_id": "bmk-v1-028",
      "candidate_sha256": "dfa9dc1ada25c78e108c8f9e979818fe3316a64e46427f26e29018b183054774",
      "protected_content": "pass",
      "unit_id": "499293ac8a1917dfcdce041709a06e1de6c78e05ff94a493fb944bac243dfacb"
    },
    {
      "benchmark_id": "bmk-v1-029",
      "candidate_sha256": "4ce1468821a0feb9009b4dbfdcf5ae9d208d3a3d415e31eeb70fd6214d762451",
      "protected_content": "pass",
      "unit_id": "462c90056a09fcdf4e5ac0ddaf90fad6a6e6e61385e1b4bd90c43c3b4a029b2d"
    },
    {
      "benchmark_id": "bmk-v1-030",
      "candidate_sha256": "81f764836bbc44c02a58bca6baa3360bf3cfb456a5acb2b9f9a41333a93a6221",
      "protected_content": "pass",
      "unit_id": "5e7a7248655ec66089d7c28b254c822dde408e51a1a22e4dd89ef504e44bbae9"
    },
    {
      "benchmark_id": "bmk-v1-031",
      "candidate_sha256": "a64cfae038a6216a58a63e59af2e420f672838253de872251fc869e27618ab26",
      "protected_content": "pass",
      "unit_id": "3811b7fe45c35fb1e3aeaa894dbcdc3424c935bb8eb363c913f0d9e6cdbe5a7b"
    },
    {
      "benchmark_id": "bmk-v1-032",
      "candidate_sha256": "0d2f9c57c1d63d1680ea425d975064b1db630cf49ef46361241fb21a703c380d",
      "protected_content": "pass",
      "unit_id": "6e7f1485aaef45dfaee165e3c5002856449485897c48179ab17a12655e213cde"
    },
    {
      "benchmark_id": "bmk-v1-033",
      "candidate_sha256": "854dfea7e0e5fcd652f6e56043b5e4fce5631ea37608f1a7e553fa95a335b550",
      "protected_content": "pass",
      "unit_id": "d07747d890f1cd391648c1f67248a7bc0e49ce077602a61a300f1494e165f7fe"
    },
    {
      "benchmark_id": "bmk-v1-034",
      "candidate_sha256": "a056b623f9c386e5cb368957e537452197a559e0c481f84f5b92f01da2cfc779",
      "protected_content": "pass",
      "unit_id": "501d277bb4977ae6b64c0f81c380d7cee3be31a0c4787004b5775a60e1ffd584"
    },
    {
      "benchmark_id": "bmk-v1-035",
      "candidate_sha256": "56823f006de428ea64fb0800d5d0de19d9a9fba82d424076996d471f88705973",
      "protected_content": "pass",
      "unit_id": "f527c2b0117a1d963fee846550492907150c1568f48bd3da6cb0a42c647845f4"
    },
    {
      "benchmark_id": "bmk-v1-036",
      "candidate_sha256": "1099494062d012d6366e9b7190458f7c773fc4808509c47c4163645c8f4d5240",
      "protected_content": "pass",
      "unit_id": "1b7b213f08df526edf1032b65ea93299ec011751eb826d95e6e11eab5654d377"
    },
    {
      "benchmark_id": "bmk-v1-037",
      "candidate_sha256": "31bd5f6d179bdf5efd6c63b92cd22ed4cb3392da799465bbc8ba67b1a5b485bb",
      "protected_content": "fail",
      "unit_id": "2f9ed0e45f825bfeca4eae49be1fbb8020c8ab1b226ea346e96b90eae1b6d102"
    },
    {
      "benchmark_id": "bmk-v1-038",
      "candidate_sha256": "21ad4202a858b74dee02cbe8ef75c1164d8589a1086de2c7e4842f6cf87d4dd8",
      "protected_content": "pass",